### ISSUE TITLE
Convert curl option "-F" to RestFixture parameters

### ISSUE THREAD

**Issue by abelyaevskiy** [smartrics/RestFixture#134]
Hi!

I have curl request to upload file:
`curl -X POST -v -H "Authorization: Bearer ea1d949d-5564-4cb0-9ee1-1f9c408ac143" -F "originalFileName=testFile" -F "file=@test.file" http://10.76.243.17:8080/data/objects?type=testObj`

And I need to convert it to RestFixture test.

Could you please help me with the issue?

I created following test
| Table:smartrics.rest.fitnesse.fixture.RestFixture | ${SERVER} |
| setHeaders | !-Authorization: Bearer %accessToken%
Content-Type:  multipart/form-data-! |
| setMultipartFileName | /home/sk/fitnesse_cranberry/test.file |
| setMultipartFileParameterName | originalFileName=testFileName |
| POST | /data/objects?type=testObjfile | | | |

And get for the request internal server error with exception that `originalFileName` parameter is not found.

I tcpdump-ed both requests
* curl
```
2:53:58.725475 IP belyaa2l1c.corp.emc.com.55564 > 10.76.243.17.http-alt: Flags [P.], seq 1:297, ack 1, win 53248, length 296
E..P.u@.w..2
E.^
L........=P..EEP.......POST /data/objects?type=testObj HTTP/1.1
User-Agent: curl/7.39.0
Host: 10.76.243.17:8080
Accept: */*
Authorization: Bearer ea1d949d-5564-4cb0-9ee1-1f9c408ac143
Content-Length: 327
Expect: 100-continue
Content-Type: multipart/form-data; boundary=------------------------8a155643b605159a


02:53:58.725547 IP 10.76.243.17.http-alt > belyaa2l1c.corp.emc.com.55564: Flags [.], ack 297, win 237, length 0
E..(..@.?.].
L..
E.^......EE..>xP...
...
02:53:58.725911 IP 10.76.243.17.http-alt > belyaa2l1c.corp.emc.com.55564: Flags [P.], seq 1:26, ack 297, win 237, length 25
E..A..@.?.].
L..
E.^......EE..>xP...
4..HTTP/1.1 100 Continue


02:53:58.736668 IP belyaa2l1c.corp.emc.com.55564 > 10.76.243.17.http-alt: Flags [P.], seq 297:563, ack 26, win 53241, length 266
E..2.v@.w..O
E.^
L........>x..E^P.......--------------------------8a155643b605159a
Content-Disposition: form-data; name="originalFileName"

testFile
--------------------------8a155643b605159a
Content-Disposition: form-data; name="file"; filename="test.file"
Content-Type: application/octet-stream


02:53:58.775484 IP 10.76.243.17.http-alt > belyaa2l1c.corp.emc.com.55564: Flags [.], ack 563, win 245, length 0
E..(..@.?.].
L..
E.^......E^..?.P...
...
02:53:58.785912 IP belyaa2l1c.corp.emc.com.55564 > 10.76.243.17.http-alt: Flags [P.], seq 563:624, ack 26, win 53241, length 61
E..e.x@.w...
E.^
L........?...E^P.......Test content

--------------------------8a155643b605159a--

02:53:58.786027 IP 10.76.243.17.http-alt > belyaa2l1c.corp.emc.com.55564: Flags [.], ack 624, win 245, length 0
E..(..@.?.].
L..
E.^......E^..?.P...
...
02:53:58.795187 IP 10.76.243.17.http-alt > belyaa2l1c.corp.emc.com.55564: Flags [P.], seq 26:858, ack 624, win 245, length 832
E..h..@.?.Z.
L..
[..HTTP/1.1 200 OK.
```
* RestFixture
```
02:49:31.042052 IP 10.76.243.121.43030 > 10.76.243.17.http-alt: Flags [P.], seq 1:501, ack 1, win 229, options [nop,nop,TS val 926906700 ecr 712675658], length 500
E..(w.@.@...
L.y
L...........k.............
7?yL*z.JPOST /data/objects?type=testObjfile HTTP/1.1
Authorization: Bearer ea1d949d-5564-4cb0-9ee1-1f9c408ac143
Content-Type: multipart/form-data
User-Agent: Jakarta Commons-HttpClient/3.1
Host: 10.76.243.17:8080
Content-Length: 267

--KOClf7DiyUgiWW-UXNTZnlVVoM1nCNrm6aSmCf6
Content-Disposition: form-data; name="file"; filename="test.file"
Content-Type: application/octet-stream; charset=ISO-8859-1
Content-Transfer-Encoding: binary

Test content

--KOClf7DiyUgiWW-UXNTZnlVVoM1nCNrm6aSmCf6--

02:49:31.042108 IP 10.76.243.17.http-alt > 10.76.243.121.43030: Flags [.], ack 501, win 235, options [nop,nop,TS val 712675659 ecr 926906700], length 0
E..4..@.?...
L..
L.y.....k...........I.....
*z.K7?yL
02:49:31.056569 IP 10.76.243.17.http-alt > 10.76.243.121.43030: Flags [.], seq 1:8689, ack 501, win 235, options [nop,nop,TS val 712675663 ecr 926906700], length 8688
E."$..@.?...
L..
L.y.....k...........:.....
*z.O7?yLHTTP/1.1 500 Internal Server Error
Server: Apache-Coyote/1.1
X-Content-Type-Options: nosniff
X-XSS-Protection: 1; mode=block
Cache-Control: no-cache, no-store, max-age=0, must-revalidate
Pragma: no-cache
Expires: 0
X-Frame-Options: DENY
Content-Type: text/html;charset=utf-8
Content-Language: en
Transfer-Encoding: chunked
Date: Tue, 15 Sep 2015 09:49:30 GMT
Connection: close
```

I see tha curl performs several requests in first one it sends `Content-Disposition: form-data; name="originalFileName"` which RestFixture cannot do. 

But currently I do not have an idea how to convert curl request to RestFixture one correctly.

**Comment by smartrics** [comment]
I wont be able to implement this but I am happy to get a pull request
